{
  "schemaVersion": 1,
  "fixture": "renderer-abi",
  "scope": {
    "interpolation": "nearest",
    "convolution": "time-domain",
    "sourceCount": 1,
    "room": "off-only",
    "excludedNumericParity": [
      "spherical",
      "room-nonzero"
    ]
  },
  "abi": {
    "inputLayout": "object-major-planar-mono",
    "inputStrideUnit": "f32-elements",
    "objectSlotsUnit": "u32-elements",
    "objectParams": [
      "azimuthDeg",
      "elevationDeg",
      "distance",
      "gain"
    ],
    "outputLayout": "planar-stereo",
    "lengthUnit": "f32-elements",
    "successCode": 0
  },
  "tolerance": {
    "kind": "relative",
    "value": 0.00001,
    "floor": 1e-7
  },
  "grid": {
    "sampleRate": 48000,
    "azimuths": [
      -90,
      0,
      90
    ],
    "elevations": [
      -30,
      0,
      30
    ],
    "hrirLength": 4,
    "directions": [
      {
        "azimuthDeg": -90,
        "elevationDeg": -30,
        "left": [
          0.44999998807907104,
          0.11999999731779099,
          -0.03999999910593033,
          0.009999999776482582
        ],
        "right": [
          0.699999988079071,
          -0.05999999865889549,
          0.029999999329447746,
          -0.014999999664723873
        ]
      },
      {
        "azimuthDeg": 0,
        "elevationDeg": -30,
        "left": [
          0.5299999713897705,
          0.11999999731779099,
          -0.029999999329447746,
          0.009999999776482582
        ],
        "right": [
          0.6100000143051147,
          -0.05999999865889549,
          0.02500000037252903,
          -0.014999999664723873
        ]
      },
      {
        "azimuthDeg": 90,
        "elevationDeg": -30,
        "left": [
          0.6100000143051147,
          0.11999999731779099,
          -0.019999999552965164,
          0.009999999776482582
        ],
        "right": [
          0.5199999809265137,
          -0.05999999865889549,
          0.019999999552965164,
          -0.014999999664723873
        ]
      },
      {
        "azimuthDeg": -90,
        "elevationDeg": 0,
        "left": [
          0.47999998927116394,
          0.10499999672174454,
          -0.03999999910593033,
          0.009999999776482582
        ],
        "right": [
          0.7200000286102295,
          -0.05000000074505806,
          0.029999999329447746,
          -0.014999999664723873
        ]
      },
      {
        "azimuthDeg": 0,
        "elevationDeg": 0,
        "left": [
          0.5600000023841858,
          0.10499999672174454,
          -0.029999999329447746,
          0.009999999776482582
        ],
        "right": [
          0.6299999952316284,
          -0.05000000074505806,
          0.02500000037252903,
          -0.014999999664723873
        ]
      },
      {
        "azimuthDeg": 90,
        "elevationDeg": 0,
        "left": [
          0.6399999856948853,
          0.10499999672174454,
          -0.019999999552965164,
          0.009999999776482582
        ],
        "right": [
          0.5400000214576721,
          -0.05000000074505806,
          0.019999999552965164,
          -0.014999999664723873
        ]
      },
      {
        "azimuthDeg": -90,
        "elevationDeg": 30,
        "left": [
          0.5099999904632568,
          0.09000000357627869,
          -0.03999999910593033,
          0.009999999776482582
        ],
        "right": [
          0.7400000095367432,
          -0.03999999910593033,
          0.029999999329447746,
          -0.014999999664723873
        ]
      },
      {
        "azimuthDeg": 0,
        "elevationDeg": 30,
        "left": [
          0.5899999737739563,
          0.09000000357627869,
          -0.029999999329447746,
          0.009999999776482582
        ],
        "right": [
          0.6499999761581421,
          -0.03999999910593033,
          0.02500000037252903,
          -0.014999999664723873
        ]
      },
      {
        "azimuthDeg": 90,
        "elevationDeg": 30,
        "left": [
          0.6700000166893005,
          0.09000000357627869,
          -0.019999999552965164,
          0.009999999776482582
        ],
        "right": [
          0.5600000023841858,
          -0.03999999910593033,
          0.019999999552965164,
          -0.014999999664723873
        ]
      }
    ]
  },
  "distance": {
    "params": {
      "referenceDistance": 1,
      "maximumDistance": 12,
      "rolloffFactor": 1
    },
    "cases": [
      {
        "id": "inverse-reference",
        "model": "inverse",
        "distance": 1,
        "expectedGain": 1,
        "expectedAirCoefficient": 0.2303345948457718
      },
      {
        "id": "inverse-far",
        "model": "inverse",
        "distance": 6,
        "expectedGain": 0.1666666716337204,
        "expectedAirCoefficient": 0.07207078486680984
      },
      {
        "id": "linear-far",
        "model": "linear",
        "distance": 6,
        "expectedGain": 0.5454545617103577,
        "expectedAirCoefficient": 0.07207078486680984
      },
      {
        "id": "exponential-clamped",
        "model": "exponential",
        "distance": 20,
        "expectedGain": 0.0833333358168602,
        "expectedAirCoefficient": 0.024625010788440704
      }
    ]
  },
  "nearestCases": [
    {
      "id": "exact-center",
      "azimuthDeg": 0,
      "elevationDeg": 0,
      "expected": {
        "azimuthIndex": 1,
        "elevationIndex": 1,
        "left": [
          0.5600000023841858,
          0.10499999672174454,
          -0.029999999329447746,
          0.009999999776482582
        ],
        "right": [
          0.6299999952316284,
          -0.05000000074505806,
          0.02500000037252903,
          -0.014999999664723873
        ]
      }
    },
    {
      "id": "wrap-positive",
      "azimuthDeg": 271,
      "elevationDeg": 80,
      "expected": {
        "azimuthIndex": 0,
        "elevationIndex": 2,
        "left": [
          0.5099999904632568,
          0.09000000357627869,
          -0.03999999910593033,
          0.009999999776482582
        ],
        "right": [
          0.7400000095367432,
          -0.03999999910593033,
          0.029999999329447746,
          -0.014999999664723873
        ]
      }
    },
    {
      "id": "wrap-negative",
      "azimuthDeg": -271,
      "elevationDeg": -80,
      "expected": {
        "azimuthIndex": 2,
        "elevationIndex": 0,
        "left": [
          0.6100000143051147,
          0.11999999731779099,
          -0.019999999552965164,
          0.009999999776482582
        ],
        "right": [
          0.5199999809265137,
          -0.05999999865889549,
          0.019999999552965164,
          -0.014999999664723873
        ]
      }
    },
    {
      "id": "nearest-right-upper",
      "azimuthDeg": 68,
      "elevationDeg": 22,
      "expected": {
        "azimuthIndex": 2,
        "elevationIndex": 2,
        "left": [
          0.6700000166893005,
          0.09000000357627869,
          -0.019999999552965164,
          0.009999999776482582
        ],
        "right": [
          0.5600000023841858,
          -0.03999999910593033,
          0.019999999552965164,
          -0.014999999664723873
        ]
      }
    },
    {
      "id": "tie-keeps-first",
      "azimuthDeg": 45,
      "elevationDeg": 15,
      "expected": {
        "azimuthIndex": 1,
        "elevationIndex": 1,
        "left": [
          0.5600000023841858,
          0.10499999672174454,
          -0.029999999329447746,
          0.009999999776482582
        ],
        "right": [
          0.6299999952316284,
          -0.05000000074505806,
          0.02500000037252903,
          -0.014999999664723873
        ]
      }
    }
  ],
  "rendererCases": [
    {
      "id": "delta-right-asymmetric",
      "input": [
        1,
        0,
        0,
        0,
        0,
        0,
        0,
        0
      ],
      "inputStride": 10,
      "blockSizes": [
        8
      ],
      "azimuthDeg": 90,
      "elevationDeg": 0,
      "distance": 1,
      "gain": 1,
      "distanceModel": "inverse",
      "roomMode": "off",
      "resetReplay": false,
      "objectSlots": [
        0
      ],
      "expected": {
        "left": [
          0.14741413295269012,
          0.1376446932554245,
          0.10133367776870728,
          0.08029637485742569,
          0.06180134043097496,
          0.04756635054945946,
          0.03661017492413521,
          0.028177587315440178
        ],
        "right": [
          0.1243806853890419,
          0.08421478420495987,
          0.06942389905452728,
          0.04997815564274788,
          0.03846646100282669,
          0.029606305062770844,
          0.022786948829889297,
          0.017538323998451233
        ]
      }
    },
    {
      "id": "distance-air-step",
      "input": [
        1,
        1,
        1,
        1,
        1,
        1,
        1,
        1
      ],
      "inputStride": 8,
      "blockSizes": [
        8
      ],
      "azimuthDeg": 0,
      "elevationDeg": 0,
      "distance": 6,
      "gain": 0.75,
      "distanceModel": "inverse",
      "roomMode": "off",
      "resetReplay": false,
      "objectSlots": [
        0
      ],
      "expected": {
        "left": [
          0.00504495482891798,
          0.010672245174646378,
          0.015623706392943859,
          0.020308401435613632,
          0.02465546689927578,
          0.02868923544883728,
          0.03243228793144226,
          0.03590557351708412
        ],
        "right": [
          0.0056755742989480495,
          0.010491662658751011,
          0.01518587302416563,
          0.01940663531422615,
          0.02332320623099804,
          0.026957504451274872,
          0.030329875648021698,
          0.03345920145511627
        ]
      }
    },
    {
      "id": "short-final-block",
      "input": [
        0.5,
        -0.25,
        0.75,
        0,
        -0.5,
        0.125,
        0.25
      ],
      "inputStride": 9,
      "blockSizes": [
        3,
        3,
        1